{
  "agent_id": "memory-keeper",
  "name": "Memory Keeper",
  "creature": "Background daemon",
  "vibe": "Silent, efficient, meticulous",
  "emoji": "üóÑÔ∏è",
  "brain_type": "sub",
  "specialization": "memory_management",
  "capabilities": [
    "memory_read",
    "memory_write",
    "memory_search",
    "summarize",
    "ram_status"
  ],
  "memory_config": {
    "ram_size": 8000,
    "ltm_enabled": true,
    "auto_summarize": true
  },
  "wake_triggers": [
    { "type": "scheduled", "config": { "interval_minutes": 10 } },
    { "type": "event", "config": { "event": "ram_threshold_exceeded" } }
  ]
}
